name,number_of_reviews,review_scores_value,cancellation_policy,host_id,host_name,host_for_x_days,host_response_time,host_response_rate,property_type,room_type,accommodates,price,security_deposit,cleaning_fee,minimum_nights,maximum_nights
Charming room in pet friendly apt,36,9,2,2572247,Andrea,3389,within an hour,100,Apartment,Private room,2,65,95,10,2,15
Spacious Sunny Bedroom Suite in Historic Home,1,10,2,6031442,Meghna,3071,within a few hours,100,House,Private room,4,75,100,50,1,1125
Perfect & Practical Boston Rental,33,9,3,4434391,Damon,3195,within an hour,100,Apartment,Entire home/apt,5,229,200,50,4,10
Quiet  Beauty in Boston,7,9,2,9658771,Anthony,2882,within a day,75,House,Entire home/apt,2,145,500,150,3,1125
Arborside Guest Cottage,16,10,2,74531248,Carl & Judy,1938,within an hour,100,House,Entire home/apt,3,120,150,50,2,6
Spacious 3 bedroom cape cod style,21,10,1,23127285,Jesús,2515,within a day,100,House,Entire home/apt,8,150,150,100,3,1125
Adorable  Apt. 20 min from Downtown,2,10,3,37177446,Nelson And Marlene,2271,within an hour,100,Apartment,Entire home/apt,6,200,200,85,2,1125
Charming 3 bedroom-15 min to Boston,24,9,3,6570877,Juliet,3037,within an hour,98,House,Entire home/apt,16,125,250,50,1,1125
Charming new house-15 min to Boston,82,9,3,6570877,Juliet,3037,within an hour,98,House,Entire home/apt,16,200,250,50,1,1125
Lovely & Gracious Victorian room,21,9,1,19223882,Rosa,2605,within a few hours,100,House,Private room,1,78,500,25,3,1125
Charming sunlit house in Boston,26,9,3,7723912,Fj,2976,within a few hours,77,House,Entire home/apt,4,145,446,56,5,1125
Cozy in Rozzie!,9,10,3,7506913,Maria Cecilia,2986,within a few hours,100,House,Private room,1,75,200,50,3,1125
1bd Boston apt - Convenient & quiet,53,10,3,16343599,Ella & Will,2663,within a few hours,90,Apartment,Entire home/apt,3,95,250,35,1,180
Quiet Sunlit Attic Studio,3,10,3,7723912,Fj,2976,within a few hours,77,Apartment,Entire home/apt,2,89,223,45,3,1125
Private House in Roslindale/Boston/Arboretum,2,6,3,68001856,Laura,1977,within an hour,100,House,Entire home/apt,7,285,500,125,3,1125
"Beautiful, Expansive Space in JP",18,8,3,19280995,Kaitlin,2604,within a few hours,73,House,Private room,2,46,200,50,2,40
Qn BR/Private Bath/Superhost/JP Ctr,17,9,3,5028116,Jason,3142,within a few hours,100,Apartment,Private room,2,120,500,80,1,1125
Lg sunny room w/private entrance,9,10,1,987917,Helder,3683,within a day,100,House,Private room,2,70,100,20,1,1125
Clean Apartment in Boston,47,9,2,12937716,Jean-Ellen,2750,within an hour,90,Apartment,Entire home/apt,6,168,200,120,3,1125
Bright room with queen sized bed,17,9,1,987917,Helder,3683,within a day,100,House,Private room,2,65,100,15,1,1125
Priv apt w/2 Beds 1 bath close to Medical/Downtown,2,9,1,30314324,Eileen,2363,within a few hours,100,Apartment,Entire home/apt,4,150,200,50,5,120
"Cozy bedroom near train, bus, parks",6,10,2,25636575,Karin,2447,within a few hours,100,Apartment,Private room,2,87,95,25,2,10
Spacious Apartment in Jamaica Plain,6,10,3,5153431,Katie And Joe,3132,within an hour,100,Apartment,Entire home/apt,6,250,250,90,4,14
Pondside Paradise with Piano,14,9,3,1922657,Catherine,3474,within a few hours,100,Apartment,Entire home/apt,6,150,500,200,2,1125
"Convenient, Sunny 3b/2bth w/Parking",3,9,1,352441,Lillie,3895,within a few hours,100,House,Entire home/apt,7,300,500,140,2,1125
"Historic Carriage House, a peaceful city oasis",148,10,2,14696258,Sarah,2703,within a few hours,100,Apartment,Entire home/apt,2,175,250,25,2,1125
"Large, sunny, cozy home w/character",24,10,3,1498417,Chad,3567,within an hour,100,House,Entire home/apt,6,195,100,95,4,1125
Boston 2 bedroom top floor condo w/balcony!,4,9,3,4191762,Jeff,3224,within a few hours,100,Condominium,Entire home/apt,4,145,400,80,2,1125
Vintage Apt With 3 Large Bedrooms,8,8,1,11487565,Josefa,2797,within an hour,100,Apartment,Entire home/apt,6,500,400,100,1,1125
Private Apartment!,66,9,2,24584716,Miriam,2476,within an hour,100,Apartment,Entire home/apt,5,130,200,45,2,1125
Sunny apartment in Boston hosts 6,39,9,2,15760345,Balint,2677,within a few hours,100,Apartment,Entire home/apt,6,190,500,80,2,1125
Luxury Apt near Restaurants&Pond&T,18,10,3,21644095,David,2552,within an hour,100,Apartment,Entire home/apt,8,399,100,120,2,1125
Designers Haven: II - whole apt!!!,13,9,2,8021,L&B (Len & Becky Or Blenky*),4596,within an hour,94,Apartment,Entire home/apt,5,350,100,50,1,270
Fully Renovated Room in JP,20,8,1,11487565,Josefa,2797,within an hour,100,Apartment,Private room,2,107,200,60,2,1125
"Quiet, Private Room with Comfy Bed",21,9,3,32071442,Sarah,2335,within a few hours,92,House,Private room,2,105,200,7,2,1125
Treetop Haven in the City,115,10,3,1035747,Maria Elena,3672,within a day,100,Apartment,Entire home/apt,2,100,100,50,3,31
Funky Alcove for 2/Superhost/JP Ctr,10,10,3,5028116,Jason,3142,within a few hours,100,Apartment,Shared room,2,100,500,50,1,1125
"Quiet, Spacious 2BD in Boston's JP!",11,10,3,35962316,Zack,2285,within a few hours,100,Apartment,Entire home/apt,5,200,200,100,2,1125
Large Sunny Apartment in JP,2,9,3,4210157,Marian,3222,within an hour,90,Apartment,Entire home/apt,8,300,300,100,4,1125
Treetop Room in Sunny Pondside Home,13,9,3,1922657,Catherine,3474,within a few hours,100,Apartment,Private room,4,125,300,50,1,1125
Treetop 2+BR Condo w/ Guest Hammock,8,10,3,1622932,Cara,3530,within a day,100,Condominium,Entire home/apt,5,114,250,80,4,1125
One Bedroom Studio Garden Apartment,8,9,3,119381,Gordon And Alexandra,4152,within an hour,100,Apartment,Entire home/apt,2,185,200,50,3,365
Family-Friendly Victorian Townhouse,1,10,3,9991368,Caitlin,2865,within a day,67,House,Entire home/apt,6,275,450,80,3,9
2 bedroom Jamaica Plain Egleston Square w/ parking,20,9,2,206353,Perry,4047,within an hour,100,Apartment,Entire home/apt,5,192,650,64,3,185
Beautiful Apartment in Boston!,99,9,2,25932315,Heriberto,2441,within an hour,100,Apartment,Entire home/apt,5,175,500,40,2,1125
TWO BEDROOM APARTMENT,23,9,2,24584716,Miriam,2476,within an hour,100,Apartment,Entire home/apt,6,168,200,50,2,1125
Jamaica Plain's Urban Oasis,127,10,3,18190121,Andrea,2620,within an hour,100,Apartment,Entire home/apt,3,114,200,45,2,30
The Roost -  Fox Room,97,10,1,6391436,Robin And Victoria,3048,within an hour,100,House,Private room,3,80,150,30,3,30
Diamond House -2- Victorian Jewel,8,10,3,3129367,Louis,3334,within an hour,100,Apartment,Entire home/apt,4,225,500,100,3,365
Spacious 5BR Condo Near Metro,20,9,3,635157,Catlin,3765,within a few hours,90,Condominium,Entire home/apt,10,383,2000,250,3,1125
Cozy Room In JP,9,9,2,51236938,Vanessa,2105,within an hour,100,Apartment,Private room,2,50,100,20,1,1125
Luxury loft w/ beautiful city view,16,9,3,29531596,Marcus,2376,within an hour,100,Apartment,Entire home/apt,4,300,100,50,1,1125
"Colorful artist home, prime location!",1,10,3,5215706,Alexis,3127,within a day,60,Apartment,Entire home/apt,2,100,300,70,1,1125
The City Cabin - 2 blocks to Subway,32,10,2,31655122,Bonnie,2341,within an hour,100,Apartment,Entire home/apt,4,130,100,20,1,1125
"Private room, Boston with breakfast",1,10,2,5965548,Colombine,3075,within a few hours,100,Apartment,Private room,2,100,500,9,1,4
Sweet penthouse in historic Boston,18,9,3,4147257,Jenn,3229,within a few hours,100,Condominium,Entire home/apt,2,125,250,60,2,1125
French Country 2bd/2bth Heart of JP,1,10,2,36278389,Jessica,2281,within a few hours,100,Apartment,Entire home/apt,4,250,500,100,1,1125
Qn BR/deck/Jacuzzi/Superhost/JP Ctr,5,10,3,5028116,Jason,3142,within a few hours,100,Condominium,Private room,2,120,500,80,1,1125
Entire Tree-Top 1BR Condo in JP on T + Parking,2,10,3,50464388,Edana,2115,within an hour,100,Condominium,Entire home/apt,2,119,300,100,7,364
Spacious & Modern in Central JP,7,10,3,1633163,Toyoko,3527,within a day,100,Condominium,Entire home/apt,6,180,500,100,3,1125
Jamaica Plain's PINK ROOM,48,10,3,18190121,Andrea,2620,within an hour,100,House,Private room,5,88,200,45,2,1125
Sunny Private Studio Aptmt,104,10,2,21299112,Helen,2561,within a day,100,House,Entire home/apt,2,135,200,30,2,1125
Private room in Jamaica Plain!,10,8,2,11487565,Josefa,2797,within an hour,100,Apartment,Private room,2,125,200,60,1,1125
"Close to universities, hospitals",10,10,2,49565531,Maria,2127,within a few hours,70,House,Private room,2,84,500,20,3,1125
Diamond House -3- Victorian Jewel,5,10,3,3129367,Louis,3334,within an hour,100,Apartment,Entire home/apt,5,225,500,100,3,365
Beautiful 3 BR with Great Location,57,9,3,4210157,Marian,3222,within an hour,90,House,Entire home/apt,8,275,300,100,3,1125
Rare! Boston house near everything,5,10,3,1414385,Woody And Pauline,3593,within a few hours,100,House,Entire home/apt,8,300,500,175,3,1125
"Fantastic Design, Spacious Boston",7,9,2,1827998,Alexis,3489,within an hour,100,Apartment,Entire home/apt,4,175,100,50,3,7
Studio & Bath On 1st Floor in JP Boston Near Train,61,9,3,20912254,Liz And Dale,2571,within an hour,100,Townhouse,Entire home/apt,2,94,200,20,1,1125
Beautiful 3 bd-2 ba  with parking.,74,9,3,9622924,Emmanuel,2885,within an hour,100,Apartment,Entire home/apt,6,168,350,69,2,250
Cozy JP Studio-Best Location!,152,9,3,965697,Chris & Kristina,3688,within an hour,100,Apartment,Entire home/apt,2,135,250,40,2,1125
Home Away from Home,28,10,1,3381271,Margaret,3309,within a few hours,100,House,Entire home/apt,2,130,300,35,2,1125
"Clean, Comfortable, Convenient and Close to the T",17,10,2,49640474,Nancy,2126,within a few hours,100,Condominium,Private room,1,65,200,15,3,1125
Private Room in convenient location,5,10,2,18589253,Will,2615,within a few hours,100,Apartment,Private room,2,55,200,30,2,1125
Clean apartment in trendy JP Boston,5,9,2,847177,Brendan,3712,within an hour,100,Apartment,Private room,3,72,95,15,1,1125
Beautiful house in Jamaica Plain,3,10,3,9155267,Derek,2908,within a few hours,100,House,Entire home/apt,6,300,500,50,4,15
"Lg. Victorian Home, 7min to T",19,9,1,987917,Helder,3683,within a day,100,House,Entire home/apt,12,480,200,75,1,1125
Unique Find: Private home in City!,49,9,3,2796082,Margaret,3365,within an hour,100,House,Entire home/apt,9,550,300,100,3,21
2 Bdrm Apt w/ tower in JP Victorian,32,10,2,1487352,Matt And Eva,3570,within an hour,100,Apartment,Entire home/apt,4,180,95,80,2,31
Fab House in Hip J.P.,8,10,2,5988470,Nikki,3074,within a day,86,House,Entire home/apt,5,325,300,90,3,1125
Full beautiful house w/ parking & deck!,41,9,2,1693497,Melissa,3514,within an hour,100,House,Entire home/apt,4,159,500,100,2,1125
"Private Floor, Private Bath, City Location",16,10,3,1956464,Maria,3470,a few days or more,0,House,Private room,2,200,100,50,2,120
1 Bedroom Jamaica Plain,9,10,2,23916912,Zach,2495,within a day,100,Apartment,Entire home/apt,3,99,200,35,2,1125
The Roost-Master Suite-The Lion,97,10,2,6391436,Robin And Victoria,3048,within an hour,100,House,Private room,3,93,100,40,3,30
Large Comfortable Home in JP,6,10,2,13271600,Carol,2740,within a day,60,House,Entire home/apt,10,500,200,100,3,1125
Gorgeous 2 bed/1 bth ideal location,8,8,2,7419610,Ariel,2990,within a few hours,100,Apartment,Entire home/apt,4,295,400,50,1,30
Lovely Single Family Colonial Home,28,10,3,4705050,Jared,3168,within a few hours,100,House,Entire home/apt,11,450,500,175,3,1125
Family-friendly townhouse in JP,5,10,3,449295,Dorothy & Seth,3836,within a few hours,100,House,Entire home/apt,4,150,100,75,1,1125
Luxury Apt off Centre St & JP Pond,12,10,3,21644095,David,2552,within an hour,100,Apartment,Entire home/apt,8,399,100,120,2,1125
Lovely 2BR+ 2BA JP Cntr/Superhost,3,9,3,5028116,Jason,3142,within a few hours,100,House,Entire home/apt,6,250,1000,100,1,1125
Cute & Comfy in JP!,4,10,3,19280995,Kaitlin,2604,within a few hours,73,House,Private room,2,56,100,30,1,1125
JP Gem near T 2BR sleeps 6! Spacious and Clean,14,9,3,72882793,Liesl &,1947,within an hour,100,Apartment,Entire home/apt,6,220,250,75,2,1125
Wonderful home Great Neighborhood mins from Boston,1,10,3,11725202,Alicia And Kostas,2789,within an hour,100,House,Entire home/apt,5,180,1500,150,21,84
Quiet 2BD+ w/ parking by Stonybrook,7,10,2,3310704,Kyle & Sefira,3316,within a few hours,100,Apartment,Entire home/apt,3,170,500,60,2,1125
Newly remodeled pet-friendly 2 bed w/ gym by park!,7,10,3,314576,Josh,3935,within an hour,100,House,Entire home/apt,4,115,350,70,1,60
Loft & Bath On Top Floor in JP Boston Near Train,44,10,3,20912254,Liz And Dale,2571,within an hour,100,Townhouse,Private room,2,86,200,20,1,1125
Super Studio-Private and Convenient,230,10,3,965697,Chris & Kristina,3688,within an hour,100,House,Entire home/apt,3,145,250,40,2,1125
Elegant Space in JP!,13,9,3,19280995,Kaitlin,2604,within a few hours,73,House,Private room,2,81,200,75,1,1125
"Bed, Bath & Beyond in Jamaica Plain",94,10,3,14303759,Susan,2712,within a few hours,100,Apartment,Private room,2,60,200,10,1,1125
Treetop Haven-Eclectic Boston Area,7,10,3,36238599,Julie,2282,within a few hours,90,House,Entire home/apt,2,225,4500,125,2,1125
BOSTON ROOM/FREE TRANSIT/BY SUBWAY,2,7,1,41999943,Sara,2220,within an hour,100,Apartment,Private room,2,50,95,30,1,1125
Luxury condo in the heart of JP,2,10,1,11722054,Nina,2789,within a day,75,Condominium,Entire home/apt,3,225,500,75,2,29
The Roost- The Elephant Room,119,10,2,6391436,Robin And Victoria,3048,within an hour,100,House,Private room,2,85,150,30,3,30
"Sunny, Spacious and Affordable ",7,7,3,228845,Jeremy,4027,within a few hours,100,Apartment,Entire home/apt,12,525,500,130,3,365
A private room at Sunnyside,94,10,2,13372537,Molly,2737,within an hour,100,House,Private room,2,75,100,20,1,90
"Adorable, Cozy Space in JP!",23,9,3,19280995,Kaitlin,2604,within a few hours,73,House,Private room,2,49,200,50,1,40
"Bed, Bath & Beyond IV in JP",11,10,3,14303759,Susan,2712,within a few hours,100,Apartment,Private room,2,60,200,10,1,1125
Private Room w/Porch. A JP experien,14,8,2,11487565,Josefa,2797,within an hour,100,Apartment,Private room,2,85,100,60,2,1125
Amazing Design & Detail Throughout!,15,9,3,228845,Jeremy,4027,within a few hours,100,Apartment,Entire home/apt,12,725,500,130,3,365
Stony Brook T Stop JP Studio,67,9,2,5115759,Mary Kate & Javier,3134,within a few hours,100,Apartment,Entire home/apt,2,125,400,50,6,1125
Entire loft in Boston,17,9,2,2238969,Kenji,3430,within a few hours,100,Loft,Entire home/apt,4,220,600,60,3,60
Charming private bedroom with bath,1,10,3,70552156,Shahid,1961,within a few hours,100,Apartment,Private room,1,45,500,75,20,30
2 Private Rooms Near T,13,8,2,7673571,Alexandra,2978,within a few hours,100,Condominium,Private room,5,160,300,25,3,30
Room Near Downtown and Trains 市区单房,4,9,2,24950258,Angie,2466,within a day,100,House,Private room,2,45,200,6,3,1125
Boston Classic Brownstone Condo/private room,9,10,3,66654235,Zoe,1986,within an hour,100,Condominium,Private room,2,80,100,10,1,1125
"Convenient Private Room-Downtown Boston, Longwood",1,6,1,86931675,Maren,1875,within an hour,100,Apartment,Private room,2,71,300,50,1,1125
Cozy Private Room Near Transit,72,8,2,7673571,Alexandra,2978,within a few hours,100,Apartment,Private room,2,70,150,25,2,1125
Duplex Penthouse in Longwood Area,9,9,3,26988,Anne,4440,within a few hours,100,Apartment,Entire home/apt,3,115,1000,200,5,90
Private Rm near T Separate Bunkbeds,73,8,2,7673571,Alexandra,2978,within a few hours,100,Apartment,Private room,3,75,100,25,2,1125
Private Bedroom with Sunny Balcony,2,8,3,9818757,Amanda,2874,within a day,100,Apartment,Private room,2,100,100,50,5,90
One Block from the Orange Line!,73,9,3,5160525,Steven,3131,within an hour,100,Apartment,Entire home/apt,2,170,301,30,1,21
The Treehouse,10,9,3,31744945,Nathan,2340,within a day,100,Loft,Entire home/apt,3,140,100,30,4,1125
"Sunny Boston 1BR-Harvard Public Health, NEU",9,10,3,66654235,Zoe,1986,within an hour,100,Condominium,Private room,2,80,100,15,1,14
"Great Fenway Studio, Be Our Guest! ",101,8,3,5618949,Alan,3098,within an hour,100,Apartment,Entire home/apt,4,149,100,40,1,1125
"Luxury 2 BR, Private Entrance Townhouse 2",1,10,3,72882793,Liesl &,1947,within an hour,100,Guesthouse,Entire home/apt,4,289,500,100,3,1125
Lovely Back BayTownhouse in Boston 38M,9,9,3,2355815,Francine,3415,within an hour,100,House,Entire home/apt,5,500,1000,250,2,1125
In the Heart of Boston! Also,32,9,2,21851356,Gustavo,2547,within an hour,100,Bed & Breakfast,Private room,2,99,200,49,2,1125
Spectacular Boston Townhouse 36M,3,7,3,2355815,Francine,3415,within an hour,100,House,Entire home/apt,5,500,1000,250,2,1125
"2 BR Luxury Condo, Downtown Boston",30,9,2,21021264,Judy,2568,within a few hours,100,Condominium,Entire home/apt,4,390,2500,95,1,1125
New Downtown 2Bedrooms,33,8,3,3011415,Stanley And Sue,3345,within an hour,100,Apartment,Entire home/apt,4,295,300,60,3,90
Chic 2BR Near Boston Common,3,9,3,12243051,Flatbook,2772,within a few hours,71,Loft,Entire home/apt,4,259,400,95,3,1125
New 1 BD Downtown ( B ),36,9,3,3011415,Stanley And Sue,3345,within an hour,100,Apartment,Entire home/apt,3,185,200,60,3,1125
Roomy 2BR close to Boston Common,1,10,3,12243051,Flatbook,2772,within a few hours,71,Loft,Entire home/apt,4,269,400,95,3,1125
Downtown Back Bay Studio W/Parking,58,9,3,5618949,Alan,3098,within an hour,100,Apartment,Entire home/apt,4,109,100,40,1,1125
2BR Downtown Boston,30,8,3,3011415,Stanley And Sue,3345,within an hour,100,Apartment,Entire home/apt,4,295,300,60,3,1125
4BR & 2BA Downtown: Combine 2 units,8,10,3,3011415,Stanley And Sue,3345,within an hour,100,Apartment,Entire home/apt,8,375,400,120,4,1125
Convenient 2bd Downtown Apt,55,9,2,22591136,Hasan Oguz,2529,within an hour,98,Apartment,Entire home/apt,6,296,100,69,1,1125
"Room+Pvt Bathroom, Heart of Boston",80,10,3,14007443,Sarah,2720,within an hour,100,Apartment,Private room,2,159,200,20,1,31
Cozy Chinatown/South End Studio,20,9,2,15192564,Christina,2691,within a few hours,92,Apartment,Entire home/apt,3,125,400,10,2,1125
Spacious Room - Chinatown Apartment,5,10,3,20436793,Diana,2582,within a day,100,Apartment,Private room,1,100,300,30,1,1125
Downtown / Back Bay 1 Bed W/Parking,40,9,3,5618949,Alan,3098,within an hour,100,Apartment,Entire home/apt,4,149,100,40,2,1125
New 1 BD Downtown ( 1 ),33,9,3,3011415,Stanley And Sue,3345,within an hour,100,Apartment,Entire home/apt,3,250,300,60,3,1125
Spacious Downtown Apt + Courtyard,3,10,3,14007443,Sarah,2720,within an hour,100,Apartment,Entire home/apt,4,179,300,20,1,1125
2BR Lux Apt in Downtown,5,10,3,57677138,Sarra,2050,within a few hours,100,Apartment,Entire home/apt,3,319,1000,100,4,90
North End 2 BR | 1 BA Duplex in Little Italy,7,9,3,9410008,Jason,2896,within an hour,100,Apartment,Entire home/apt,6,320,450,100,3,30
Stunning Luxury North End Loft!,140,9,3,10850877,Franklin,2821,within an hour,100,Apartment,Entire home/apt,3,125,250,80,1,1125
"""La Gemma"" - a gem in the North End",57,10,1,18601802,Gina,2615,within a few hours,100,Apartment,Entire home/apt,4,285,1000,80,2,1125
"2BR/2ba Large North End, perfect location!",8,10,2,2042123,Sue,3457,within an hour,80,Apartment,Entire home/apt,5,400,200,155,1,1125
North End Gem,2,8,3,66497629,Daniele,1987,within an hour,100,Apartment,Entire home/apt,8,350,500,75,2,29
Cozy North End Studio - Perfect location!,1,10,2,69106634,Andrea,1970,within a day,100,Apartment,Entire home/apt,2,210,150,40,3,6
Artist 1BR Loft in North End,36,9,2,1723274,James,3509,within an hour,100,Apartment,Entire home/apt,3,159,500,75,1,1125
Private Queen room and Loft with 2 single beds,19,10,2,46702413,Beth,2163,within a few hours,100,House,Private room,4,120,150,25,3,14
Heart of Historic North End,3,7,2,651876,Paulina,3761,within an hour,100,Apartment,Entire home/apt,4,149,500,50,2,1125
Spacious & private in the heart of the north end,4,9,1,65646888,Jeff,1993,within an hour,100,Apartment,Entire home/apt,2,115,100,25,1,1125
"Beth's Place, feel at home.",41,10,2,46702413,Beth,2163,within a few hours,100,House,Private room,2,110,100,25,2,7
New renovation on the Freedom Trail,22,9,2,71536024,Bill,1955,within an hour,100,Apartment,Entire home/apt,4,310,100,80,1,1125
Designer 1BR North End Modern Cove,135,10,2,1723274,James,3509,within an hour,100,Apartment,Entire home/apt,4,159,500,75,1,100
Cozy Nautical North End Apt,4,10,1,79163790,Colleen,1914,within a day,90,Apartment,Entire home/apt,2,120,250,50,3,7
"Best Boston location, 2BR (M#1)",51,9,3,5578043,Dror,3101,within an hour,100,Apartment,Entire home/apt,4,129,300,95,1,365
Lodging at Boston Harbor (2 BR),3,6,2,49726270,Judith,2125,within an hour,80,Apartment,Entire home/apt,5,160,300,75,20,365
Spacious cozy Little Italy,7,10,3,5695034,Elizabeth,3093,within a day,100,Apartment,Private room,2,145,300,25,2,1125
Quiet 1BR in the heart of the North End,5,10,2,1231885,Emily,3639,within an hour,100,Apartment,Entire home/apt,3,131,200,25,1,20
Upscale Faneuil Hall / N. End Oasis,84,9,3,42431392,Frank,2216,within an hour,100,Condominium,Entire home/apt,3,150,500,80,1,1125
Authentic NORTH END 3br! Lil Italy!,15,9,3,21184200,Paige,2564,within an hour,99,Apartment,Entire home/apt,9,200,99,60,1,1125
Boston Huge 1BR Best location (h2b),43,9,3,5578043,Dror,3101,within an hour,100,Apartment,Entire home/apt,5,109,300,85,1,365
2 bedroom condo in Downtown Boston,42,9,2,2006852,Jay,3463,within an hour,100,Apartment,Entire home/apt,4,180,150,80,4,33
Cozy and Quiet North End Duplex 1 Bedroom,1,10,3,35742537,Tanya,2287,within an hour,100,Apartment,Entire home/apt,4,250,150,100,4,1125
Private room off the Freedom Trail.,160,9,3,1144302,Howard,3659,within an hour,100,House,Private room,5,69,300,60,3,1825
GORGEOUS WATER FRT NORTH END STUDIO,190,9,1,4737456,Paolo,3165,within a few hours,100,Apartment,Entire home/apt,4,125,200,50,2,30
Immaculate in the North End,75,9,2,31804748,Dave,2339,within an hour,100,Apartment,Entire home/apt,4,380,100,80,2,1125
Historic North End Modern 2 Bed,72,10,3,45037374,Stephen,2185,within an hour,100,Apartment,Entire home/apt,4,220,250,75,2,1125
Boston/gym/family friendly,5,10,3,29859334,Joy,2370,within a day,70,Apartment,Entire home/apt,4,180,250,80,3,30
Beautiful North End 1BR Apartment,8,10,3,5717433,Camille,3091,within an hour,100,Apartment,Entire home/apt,2,140,500,50,1,1125
North End - Little Italy,80,9,3,9247845,Panagioti & Suzy,2904,within an hour,100,Apartment,Entire home/apt,2,200,100,50,1,1125
Spacious North End 1 BR | 1BA,67,10,3,9410008,Jason,2896,within an hour,100,Apartment,Entire home/apt,4,199,450,80,3,45
"New, bright, clean,  2 bedroom, amazing location!!",11,9,3,3137257,Furnished Rentals,3333,within a few hours,97,Condominium,Entire home/apt,6,225,500,140,3,1125
Large 2 BR | 1BA in the North End,48,10,3,9410008,Jason,2896,within an hour,100,Apartment,Entire home/apt,6,325,450,100,2,60
Historic Boston North End Condo,73,10,3,11132080,Cindy & Mark,2809,within an hour,100,Apartment,Entire home/apt,4,175,200,95,4,1125
Boston  Best One Bdrm duplex (h2c),49,9,3,5578043,Dror,3101,within an hour,100,Apartment,Entire home/apt,3,99,300,85,1,1125
North End Get Away!,22,9,2,23631661,Brie,2502,within a few hours,100,Apartment,Entire home/apt,2,165,95,25,3,1125
Boston  Little Italy 2 Bdrms  (H2d),68,9,3,5578043,Dror,3101,within an hour,100,Apartment,Entire home/apt,6,179,300,95,1,1125
"Historic 1 BDRM, 20 Steps From Old North Church",19,9,2,57064175,Sonia,2055,within an hour,100,Apartment,Entire home/apt,4,152,150,125,3,1125
North End Gem!,36,9,3,66497629,Daniele,1987,within an hour,100,Townhouse,Private room,4,175,350,50,1,30
"Best Boston location, 2BR (M #3)",47,9,3,5578043,Dror,3101,within an hour,100,Apartment,Entire home/apt,4,139,300,95,1,365
Luxury 2brm/2bath apt in North End,64,9,3,2006852,Jay,3463,within an hour,100,Apartment,Entire home/apt,4,255,300,85,1,1125
"Best Boston location, 2BR (M #2)",45,8,3,5578043,Dror,3101,within an hour,100,Apartment,Entire home/apt,4,119,300,90,1,365
AIR LUXE: APARTMENT @ CORNER OF LUXURY & HISTORY,18,10,3,43384196,Alexa,2205,within a day,100,Apartment,Entire home/apt,2,275,250,100,2,1125
"Best Boston location, 2BR (M #4)",27,9,3,5578043,Dror,3101,within an hour,100,Apartment,Entire home/apt,4,139,300,90,1,365
Boston Best furnished Studio (H2a),73,9,3,5578043,Dror,3101,within an hour,100,Apartment,Entire home/apt,2,99,300,75,1,365
Little Italy spacious apartment,41,9,3,5695034,Elizabeth,3093,within a day,100,Apartment,Entire home/apt,2,135,275,25,2,25
North End Apt. w/ a view!,20,10,1,36670279,Susan,2277,within an hour,100,Apartment,Entire home/apt,5,200,500,50,2,1125
North End flat just off Hanover Street,9,10,1,1386951,Todd,3601,within a few hours,100,Apartment,Entire home/apt,2,200,150,75,2,90
North End 1 BR Gem in Little Italy,30,10,3,9410008,Jason,2896,within an hour,100,Apartment,Entire home/apt,4,195,375,80,2,45
North End - Salem St - Harbor,1,8,3,10250257,Caroline,2853,within a few hours,100,Apartment,Entire home/apt,4,235,250,75,3,1125
Downtown Boston | Modern 1 Bedroom | The North End,2,9,3,1118374,Matthew,3664,within an hour,100,Apartment,Entire home/apt,3,195,199,35,1,365
"Sweet Spot, Fort hill",2,8,3,31035017,Jason,2351,within an hour,100,Apartment,Entire home/apt,2,145,100,8,1,1125
Spacious 3BR in South End,2,8,3,12243051,Flatbook,2772,within a few hours,71,Apartment,Entire home/apt,6,209,400,95,3,1125
Spacious private bedroom in house,2,10,3,1037913,Derek,3671,within an hour,100,House,Private room,2,90,100,25,4,180
Lovely South End 1 bedroom,27,9,3,1444340,Will,3583,within a day,98,Apartment,Entire home/apt,4,167,500,100,2,1125
High End South End Loft/Silver Line,1,10,3,10778805,Paul,2825,within a few hours,100,Condominium,Private room,1,75,200,100,30,120
"Beautiful 2 Bedroom Apt, South End",52,8,3,1444340,Will,3583,within a day,98,Apartment,Entire home/apt,6,265,500,125,2,1125
Modern Studio Apartment - South End,55,8,3,1444340,Will,3583,within a day,98,Apartment,Entire home/apt,4,150,500,100,2,1125
Newly Renovated 2 Bed in South End,49,9,3,1444340,Will,3583,within a day,98,Apartment,Entire home/apt,6,275,500,125,2,1125
Convenient 1 bedroom on Tremont St,54,8,3,1444340,Will,3583,within a day,98,Apartment,Entire home/apt,4,167,500,100,2,1125
